{
  "artifact": {
    "archive_inventory_sha256": "1e0d3df3e9e04909d86f7d51d689273119eaaa81b544ab209ac0b12aa570c31d",
    "download_url": "https://files.pythonhosted.org/packages/f7/62/de5bdd77d935331f4f802edc11e4d82950f642caad6cb2f949837b8560e2/pillow-12.3.0-cp313-cp313-manylinux_2_27_x86_64.manylinux_2_28_x86_64.whl",
    "filename": "pillow-12.3.0-cp313-cp313-manylinux_2_27_x86_64.manylinux_2_28_x86_64.whl",
    "license_expression": "MIT-CMU",
    "name": "pillow",
    "package": "pillow",
    "review_status": "APPROVED",
    "sha256": "0847a763afefb695bc912d7c131e7e0632d4edc1d8698f58ddabec8e46b8b6d3",
    "size": 6937129,
    "source": "https://github.com/python-pillow/Pillow",
    "source_index": "https://pypi.org/project/Pillow/12.3.0/",
    "supplier": "Python Software Foundation / PyPI",
    "version": "12.3.0"
  },
  "bundled_components": [
    {
      "component_id": "aom",
      "evidence_materialized_text_sha256": "dda12a98c1979cf3d94df1cff45d27a4cb3f04a60c76f76902ac54cac03ec0ce",
      "evidence_normalized_lf_sha256": "dda12a98c1979cf3d94df1cff45d27a4cb3f04a60c76f76902ac54cac03ec0ce",
      "evidence_relative_path": "pillow-12.3.0.dist-info/licenses/LICENSE",
      "evidence_sha256": "dda12a98c1979cf3d94df1cff45d27a4cb3f04a60c76f76902ac54cac03ec0ce",
      "inclusion_evidence": "LICENSE_SECTION_IN_DISTRIBUTED_WHEEL",
      "license_expression": "BSD-3-Clause",
      "license_file_basename": "LICENSE",
      "name": "Alliance for Open Media codec",
      "section_marker": "\nAOM\n",
      "version": null
    },
    {
      "component_id": "brotli",
      "evidence_materialized_text_sha256": "dda12a98c1979cf3d94df1cff45d27a4cb3f04a60c76f76902ac54cac03ec0ce",
      "evidence_normalized_lf_sha256": "dda12a98c1979cf3d94df1cff45d27a4cb3f04a60c76f76902ac54cac03ec0ce",
      "evidence_relative_path": "pillow-12.3.0.dist-info/licenses/LICENSE",
      "evidence_sha256": "dda12a98c1979cf3d94df1cff45d27a4cb3f04a60c76f76902ac54cac03ec0ce",
      "inclusion_evidence": "LICENSE_SECTION_IN_DISTRIBUTED_WHEEL",
      "license_expression": "MIT",
      "license_file_basename": "LICENSE",
      "name": "Brotli",
      "section_marker": "\nBROTLI\n",
      "version": "1.2.0"
    },
    {
      "component_id": "bzip2",
      "evidence_materialized_text_sha256": "dda12a98c1979cf3d94df1cff45d27a4cb3f04a60c76f76902ac54cac03ec0ce",
      "evidence_normalized_lf_sha256": "dda12a98c1979cf3d94df1cff45d27a4cb3f04a60c76f76902ac54cac03ec0ce",
      "evidence_relative_path": "pillow-12.3.0.dist-info/licenses/LICENSE",
      "evidence_sha256": "dda12a98c1979cf3d94df1cff45d27a4cb3f04a60c76f76902ac54cac03ec0ce",
      "inclusion_evidence": "LICENSE_SECTION_IN_DISTRIBUTED_WHEEL",
      "license_expression": "bzip2-1.0.6",
      "license_file_basename": "LICENSE",
      "name": "bzip2",
      "section_marker": "\nBZIP2\n",
      "version": null
    },
    {
      "component_id": "dav1d",
      "evidence_materialized_text_sha256": "dda12a98c1979cf3d94df1cff45d27a4cb3f04a60c76f76902ac54cac03ec0ce",
      "evidence_normalized_lf_sha256": "dda12a98c1979cf3d94df1cff45d27a4cb3f04a60c76f76902ac54cac03ec0ce",
      "evidence_relative_path": "pillow-12.3.0.dist-info/licenses/LICENSE",
      "evidence_sha256": "dda12a98c1979cf3d94df1cff45d27a4cb3f04a60c76f76902ac54cac03ec0ce",
      "inclusion_evidence": "LICENSE_SECTION_IN_DISTRIBUTED_WHEEL",
      "license_expression": "BSD-2-Clause",
      "license_file_basename": "LICENSE",
      "name": "dav1d",
      "section_marker": "\nDAV1D\n",
      "version": null
    },
    {
      "component_id": "freetype",
      "evidence_materialized_text_sha256": "dda12a98c1979cf3d94df1cff45d27a4cb3f04a60c76f76902ac54cac03ec0ce",
      "evidence_normalized_lf_sha256": "dda12a98c1979cf3d94df1cff45d27a4cb3f04a60c76f76902ac54cac03ec0ce",
      "evidence_relative_path": "pillow-12.3.0.dist-info/licenses/LICENSE",
      "evidence_sha256": "dda12a98c1979cf3d94df1cff45d27a4cb3f04a60c76f76902ac54cac03ec0ce",
      "inclusion_evidence": "LICENSE_SECTION_IN_DISTRIBUTED_WHEEL",
      "license_expression": "FTL OR GPL-2.0-or-later",
      "license_file_basename": "LICENSE",
      "name": "FreeType",
      "section_marker": "\nFREETYPE2\n",
      "version": null
    },
    {
      "component_id": "harfbuzz",
      "evidence_materialized_text_sha256": "dda12a98c1979cf3d94df1cff45d27a4cb3f04a60c76f76902ac54cac03ec0ce",
      "evidence_normalized_lf_sha256": "dda12a98c1979cf3d94df1cff45d27a4cb3f04a60c76f76902ac54cac03ec0ce",
      "evidence_relative_path": "pillow-12.3.0.dist-info/licenses/LICENSE",
      "evidence_sha256": "dda12a98c1979cf3d94df1cff45d27a4cb3f04a60c76f76902ac54cac03ec0ce",
      "inclusion_evidence": "LICENSE_SECTION_IN_DISTRIBUTED_WHEEL",
      "license_expression": "MIT",
      "license_file_basename": "LICENSE",
      "name": "HarfBuzz",
      "section_marker": "\nHARFBUZZ\n",
      "version": null
    },
    {
      "component_id": "lcms2",
      "evidence_materialized_text_sha256": "dda12a98c1979cf3d94df1cff45d27a4cb3f04a60c76f76902ac54cac03ec0ce",
      "evidence_normalized_lf_sha256": "dda12a98c1979cf3d94df1cff45d27a4cb3f04a60c76f76902ac54cac03ec0ce",
      "evidence_relative_path": "pillow-12.3.0.dist-info/licenses/LICENSE",
      "evidence_sha256": "dda12a98c1979cf3d94df1cff45d27a4cb3f04a60c76f76902ac54cac03ec0ce",
      "inclusion_evidence": "LICENSE_SECTION_IN_DISTRIBUTED_WHEEL",
      "license_expression": "MIT",
      "license_file_basename": "LICENSE",
      "name": "Little CMS",
      "section_marker": "\nLCMS2\n",
      "version": null
    },
    {
      "component_id": "libavif-license-bundle",
      "evidence_materialized_text_sha256": "dda12a98c1979cf3d94df1cff45d27a4cb3f04a60c76f76902ac54cac03ec0ce",
      "evidence_normalized_lf_sha256": "dda12a98c1979cf3d94df1cff45d27a4cb3f04a60c76f76902ac54cac03ec0ce",
      "evidence_relative_path": "pillow-12.3.0.dist-info/licenses/LICENSE",
      "evidence_sha256": "dda12a98c1979cf3d94df1cff45d27a4cb3f04a60c76f76902ac54cac03ec0ce",
      "inclusion_evidence": "LICENSE_SECTION_IN_DISTRIBUTED_WHEEL",
      "license_expression": "LicenseRef-Pillow-libavif-license-bundle",
      "license_file_basename": "LICENSE",
      "name": "libavif and recorded dependencies",
      "section_marker": "\nLIBAVIF\n",
      "version": null
    },
    {
      "component_id": "libjpeg",
      "evidence_materialized_text_sha256": "dda12a98c1979cf3d94df1cff45d27a4cb3f04a60c76f76902ac54cac03ec0ce",
      "evidence_normalized_lf_sha256": "dda12a98c1979cf3d94df1cff45d27a4cb3f04a60c76f76902ac54cac03ec0ce",
      "evidence_relative_path": "pillow-12.3.0.dist-info/licenses/LICENSE",
      "evidence_sha256": "dda12a98c1979cf3d94df1cff45d27a4cb3f04a60c76f76902ac54cac03ec0ce",
      "inclusion_evidence": "LICENSE_SECTION_IN_DISTRIBUTED_WHEEL",
      "license_expression": "IJG",
      "license_file_basename": "LICENSE",
      "name": "Independent JPEG Group software",
      "section_marker": "\nLIBJPEG\n",
      "version": null
    },
    {
      "component_id": "liblzma",
      "evidence_materialized_text_sha256": "dda12a98c1979cf3d94df1cff45d27a4cb3f04a60c76f76902ac54cac03ec0ce",
      "evidence_normalized_lf_sha256": "dda12a98c1979cf3d94df1cff45d27a4cb3f04a60c76f76902ac54cac03ec0ce",
      "evidence_relative_path": "pillow-12.3.0.dist-info/licenses/LICENSE",
      "evidence_sha256": "dda12a98c1979cf3d94df1cff45d27a4cb3f04a60c76f76902ac54cac03ec0ce",
      "inclusion_evidence": "LICENSE_SECTION_IN_DISTRIBUTED_WHEEL",
      "license_expression": "0BSD",
      "license_file_basename": "LICENSE",
      "name": "liblzma / XZ Utils",
      "section_marker": "\nLIBLZMA\n",
      "version": "5.8.3"
    },
    {
      "component_id": "libpng",
      "evidence_materialized_text_sha256": "dda12a98c1979cf3d94df1cff45d27a4cb3f04a60c76f76902ac54cac03ec0ce",
      "evidence_normalized_lf_sha256": "dda12a98c1979cf3d94df1cff45d27a4cb3f04a60c76f76902ac54cac03ec0ce",
      "evidence_relative_path": "pillow-12.3.0.dist-info/licenses/LICENSE",
      "evidence_sha256": "dda12a98c1979cf3d94df1cff45d27a4cb3f04a60c76f76902ac54cac03ec0ce",
      "inclusion_evidence": "LICENSE_SECTION_IN_DISTRIBUTED_WHEEL",
      "license_expression": "Libpng-2.0",
      "license_file_basename": "LICENSE",
      "name": "libpng",
      "section_marker": "\nLIBPNG\n",
      "version": "1.6.58"
    },
    {
      "component_id": "libtiff",
      "evidence_materialized_text_sha256": "dda12a98c1979cf3d94df1cff45d27a4cb3f04a60c76f76902ac54cac03ec0ce",
      "evidence_normalized_lf_sha256": "dda12a98c1979cf3d94df1cff45d27a4cb3f04a60c76f76902ac54cac03ec0ce",
      "evidence_relative_path": "pillow-12.3.0.dist-info/licenses/LICENSE",
      "evidence_sha256": "dda12a98c1979cf3d94df1cff45d27a4cb3f04a60c76f76902ac54cac03ec0ce",
      "inclusion_evidence": "LICENSE_SECTION_IN_DISTRIBUTED_WHEEL",
      "license_expression": "libtiff",
      "license_file_basename": "LICENSE",
      "name": "libtiff",
      "section_marker": "\nLIBTIFF\n",
      "version": "4.7.1"
    },
    {
      "component_id": "libwebp",
      "evidence_materialized_text_sha256": "dda12a98c1979cf3d94df1cff45d27a4cb3f04a60c76f76902ac54cac03ec0ce",
      "evidence_normalized_lf_sha256": "dda12a98c1979cf3d94df1cff45d27a4cb3f04a60c76f76902ac54cac03ec0ce",
      "evidence_relative_path": "pillow-12.3.0.dist-info/licenses/LICENSE",
      "evidence_sha256": "dda12a98c1979cf3d94df1cff45d27a4cb3f04a60c76f76902ac54cac03ec0ce",
      "inclusion_evidence": "LICENSE_SECTION_IN_DISTRIBUTED_WHEEL",
      "license_expression": "BSD-3-Clause",
      "license_file_basename": "LICENSE",
      "name": "libwebp",
      "section_marker": "\nLIBWEBP\n",
      "version": "1.6.0"
    },
    {
      "component_id": "libyuv",
      "evidence_materialized_text_sha256": "dda12a98c1979cf3d94df1cff45d27a4cb3f04a60c76f76902ac54cac03ec0ce",
      "evidence_normalized_lf_sha256": "dda12a98c1979cf3d94df1cff45d27a4cb3f04a60c76f76902ac54cac03ec0ce",